Method,Short Description,Primary Platform,Core Technology,Monitoring Object,Temporal Resolution,Flux Estimation,Plastic Characterization,Min Team Size Required (person),Training Level Needed,Automation Level,Real-time Data Availability,Weather Dependency,Daylight Dependency,Portability & Mobility,Initial Investment Cost,Operational Cost,Maintenance,Labor Cost per Measurement,Raw Data Type,Software / AI Requirements,Key Limitations,Known Failure Modes,Usage Status,Recommended River Conditions,Best Suited For
Visual counting from bridge,Human visual counts from bridge,Bridge,Human eye,Surface items,Continuous/ Intermittent,Count-based,Count + type,2-4,Low,Manual,No,High,High,High,Low,Low,Very Low,Low,Manual counts,,"Daylight only, weather dependent","Observer fatigue, poor visibility",Widely used,"Low-flow, clear, accessible bridges","Quick, low-budget campaigns"
Visual counting from boat,Human visual counts from boat,Boat,Human eye,Surface items,Intermittent,Count-based,Count + type,3-5,Low,Manual,No,High,High,High,Low/High,High,Low/Medium,Medium,Manual counts,,"Daylight only, boat access needed","Strong current, waves",Widely used,Medium width with boat launch,Mobile spot checks
Bridge-mounted camera sensor,Automated camera on bridge,Bridge,Optical camera + AI,Surface items,Continuous,Count-based,Count + type,1,High,Automated,Yes,Low,High,Fixed,High,Medium,Medium,Very Low,Images / video,AI software required,"Needs power & maintenance, AI training",Camera vibration/dirt,Emerging (promising),Any with bridge + power,Long-term automated monitoring
Surface trawling from bridge,Net trawling from bridge,Bridge,Physical trawl net,Surface items & Submerged items,Intermittent,Mass + count,Count + type + size + weight,3-5,Medium,Manual,No,Medium,Medium,Medium,Medium,Medium,Medium,Medium,Physical samples,Lab analysis,"Bridge access, net clogging",Debris clogging,Established,"Medium flow, bridge access",Mass-flux studies
Fixed in-water trawling,Stationary net in river,Fixed in-river,Physical trawl net,Surface items * Submerged items,Continuous,Mass + count,Count + type + size + weight,2-4,Medium,Manual,No,Low,Low,Fixed,Medium,Low,Medium,Medium,Physical samples,Lab analysis,Fixed position,Net entanglement,Established,"Stable flow, low debris",Continuous baseline monitoring
Boat trawling,Active net trawling by boat,Boat,Physical trawl net,Surface items & Submerged items,Intermittent,Mass + count,Count + type + size + weight,5-7,Medium,Manual,No,High,Medium,High,Medium/ High,High,Low/Medium,High,Physical samples,Lab analysis,"High cost, weather dependent",Boat logistics,Established,"High-flow, wide width",Mass-flux studies
